NOMBRE_ESTABLECIMIENTO,ROL_ESTABLECIMIENTO
LICEO POLITECNICO ARICA,1
ESC. PEDRO VICENTE GUTIERREZ TORRES,3
LICEO OCTAVIO PALMA PEREZ,4
JOVINA NARANJO FERNANDEZ,5
L. POLI. ANTONIO VARAS DE LA BARRA,7
COL. INTEG. EDUARDO FREI MONTALBA,8
ESCUELA REPUBLICA DE ISRAEL,9
ESCUELA REPUBLICA DE FRANCIA,10
ESC. GRAL. PEDRO LAGOS MARCHANT,11
ESCUELA GRAL JOSE MIGUEL CARRERA,12
ESCUELA MANUEL RODRIGUEZ ERDOYZA,13
ESCUELA ROMULO J. PENA MATURANA,14
LICEO ARTISTICO DR. JUAN NOE CREVANI,15
ESCUELA REGIMIENTO RANCAGUA,16
ESCUELA SUBTTE. LUIS CRUZ MARTINEZ,17
ESC. COMTE. JUAN JOSE SAN MARTIN,18
ESC. HUMBERTO VALENZUELA GARCIA,19
ESCUELA TUCAPEL,20
ESCUELA LINCOYAN,21
ESCUELA GABRIELA MISTRAL,22
ESCUELA CENTENARIO,25
ESCUELA REPUBLICA DE ARGENTINA,26
ESCUELA ESMERALDA,27
ESCUELA RICARDO SILVA ARRIAGADA,28
ESCUELA AMERICA,29
ESCUELA DARIO SALAS DIAZ,31
LICEO AGRICOLA JOSE ABELARDO NUNEZ M.,32
ESCUELA CARLOS CONDELL DE LA HAZA,33
ESCUELA GRAL. MANUEL BAQUEDANO,35
ESCUELA IGNACIO CARRERA PINTO,36
ESCUELA ESPANA,38
ESCUELA PAMPA ALGODONAL,39
ESCUELA VALLE DE CHACA,41
ESCUELA MOLINOS LLUTA,42
COLEGIO ITALIANO SANTA ANA,45
COLEGIO ADVENTISTA DE ARICA,50
ESCUELA PARTICULAR REPÚBLICA DEL ECUADOR,51
LICEO DOMINGO SANTA MARIA,52
COLEGIO SAN MARCOS DE ARICA,56
COLEGIO SAN JORGE,59
COLEGIO ALEMAN DE ARICA,60
ABRAHAM LINCOLN SCHOOL,67
JUNIOR COLLEGE,69
ESCUELA VALLE DE ESQUINA,70
LICEO  VALLE DE CODPA,72
ESCUELA VALLE DE COBIJA,73
ESCUELA VALLE DE CAMARONES,74
ESCUELA VALLE DE GUANACAGUA,75
ESCUELA VALLE DE CUYA,76
LICEO GRANADEROS,78
ESCUELA EL MARQUEZ,79
ESCUELA PAYACHATAS,81
ESCUELA SAN FRANCISCO DE ASIS,82
ESCUELA COTA COTANI,83
ESCUELA LOS ALAMOS,84
ESCUELA SAN SANTIAGO DE BELEN,86
ESCUELA ANCOLACANE,87
ESCUELA ALCERRECA,88
ESCUELA HUMAPALCA,89
ESCUELA INTERNADO VISVIRI,90
ESCUELA COSAPILLA,91
ESCUELA CHISLLUMA,92
ESCUELA CHUJLLUTA,93
ESCUELA GUACOYO,94
ESCUELA COLPITAS,95
INST. COM. DE IQUIQUE BALDOMERO WOLNITZKY,97
ESC.EDUC.GRAL.BAS.Y DES.ART.VIOLETA PARRA,103
INSTITUTO DEL MAR ALMIRANTE CARLOS CONDEL,106
LICEO LIBERT. GRAL.BERNARDO O'HIGGINS,107
LICEO POLITEC. JOSE GUTIERREZ DE LA FUEN,108
LICEO ELENA DUVAUCHELLE CABEZON,109
ESCUELA DOMINGO SANTA MARIA,110
ESCUELA GABRIELA MISTRAL,111
ESCUELA EDUARDO LLANOS,112
ESCUELA ALMIRANTE PATRICIO LYNCH,113
ESCUELA PLACIDO VILLARROEL,114
ESCUELA JAVIERA CARRERA VERDUGO,115
COLEGIO REPUBLICA DE CROACIA,116
ESCUELA PAULA JARAQUEMADA ALQUIZAR,117
ESCUELA CENTENARIO,119
LICEO COM.Y TEC.ARTURO PRAT CHACON,120
ESCUELA THILDA PORTILLO OLIVARES,122
COLEGIO ESPANA,123
LICEO LUIS CRUZ MARTINEZ,124
ESCUELA PROFESOR MANUEL CASTRO RAMOS,125
COLEGIO REPUBLICA DE ITALIA,126
LICEO MARIA AUXILIADORA,127
LICEO SUPERIOR GABRIELA MISTRAL,129
COLEGIO NORTH COLLEGE,130
LICEO PARTICULAR MIXTO ESCASCE,131
LICEO ACADEMIA IQUIQUE,132
COLEGIO ADVENTISTA DE IQUIQUE,133
LICEO ATENEA,134
COLEGIO IQUIQUE YOUNG SCHOOL,144
ESCUELA BASICA FRONTERIZA,154
ESCUELA PISAGUA,156
ESCUELA CHIAPA,158
ESCUELA JAINA,159
ESCUELA PACHICA,160
LICEO DE HUARA,161
ESCUELA SIBAYA,162
ESCUELA CHUSMIZA,165
ESCUELA CAMINA,167
ESCUELA CUISAMA,168
ESCUELA QUISTAGAMA,169
ESCUELA NAMA,170
ESCUELA APAMILCA,171
ESCUELA CHAPIQUILTA,172
ESCUELA MOQUELLA,173
ESCUELA FRANCIA,174
ESCUELA YALA YALA,175
ESCUELA BASICA CARIQUIMA,177
LICEO TECNICO PROFESIONAL COLCHANE,178
ESCUELA BASICA MAUQUE,179
ESCUELA BASICA PISIGA-CHOQUE,185
ESCUELA BASICA ENQUELGA,186
ESCUELA VERTIENTE DEL SABER,187
ESC. MATILLA DE NUEVA EXTREMADURA,188
LIC. ALCDE.SERGIO GONZALEZ GUTIERREZ,191
ESCUELA BASICA MAMINA,192
ESCUELA BASICA POZO ALMONTE,193
ESCUELA BASICA LA TIRANA,195
ESCUELA BASICA HUATACONDO,196
ESCUELA BASICA LA HUAYCA,198
LICEO DOMINGO LATRILLE LASTAUNOU,199
LICEO POLITECNICO DIEGO PORTALES P.,200
ESCUELA CARLOS CONDELL DE LA HAZA,201
ESCUELA PABLO NERUDA,203
ESCUELA L.GRAL.BERNARDO O'HIGGINS R.,204
ESCUELA ARTURO PRAT CHACON,205
ESCUELA ESTADOS UNIDOS DE NORTEAMERICA,206
COLEGIO SAGRADA FAMILIA,208
ESCUELA ARTURO PEREZ CANTO,210
LICEO  H.C. T.P.  MARIA ELENA,211
ESCUELA IGNACIO CARRERA PINTO,214
LICEO LUIS CRUZ MARTINEZ,217
LICEO FRANCISCO DE AGUIRRE,218
LICEO POLITECNICO CESAREO AGUIRRE G.,219
LICEO AMERICA,220
CENTRO EDUC.INTEGRAL DE ADULTOS C.E.I.A,222
ESCUELA CLAUDIO ARRAU,223
ESCUELA GRECIA,224
ESCUELA REPUBLICA DE BOLIVIA,225
ESCUELA BASICA EMILIO SOTOMAYOR,226
ESCUELA BASICA PRESIDENTE BALMACEDA,227
ESCUELA BASICA VADO DE TOPATER,228
ESCUELA REPUBLICA DE CHILE,229
ESCUELA BASICA ANDRES BELLO,230
ESCUELA BASICA JOHN FITZGERALD KENNEDY,231
ESCUELA BASICA PEDRO VERGARA KELLER,232
ESCUELA REPUBLICA DE ECUADOR,234
ESCUELA BASICA 21 DE MAYO,239
ESCUELA BASICA REPUBLICA DE FRANCIA,240
ESCUELA BASICA PUKARA,243
ESCUELA BASICA SENORA DE LA CANDELARIA,246
ESCUELA BASICA SAN JOSE,248
ESCUELA BASICA SAN ANDRES,249
ESCUELA BASICA SAN FRANCISCO,252
COLEGIO ADVENTISTA DE CALAMA,253
FUNDACION EDUC.COLEGIO NUESTRA SRA.DE AYQUINA,254
COLEGIO  EJERCITO DE SALVACION,255
INSTITUTO OBISPO SILVA LEZAETA,256
COLEGIO CHUQUICAMATA,257
ESC. BASICA RURAL SAN ANTONIO DE PADUA,268
ESCUELA BASICA SAN PEDRO DE ATACAMA,269
ESCUELA BASICA TOCONAO,270
ESCUELA BASICA CAMAR,271
ESCUELA BASICA SOLOR,273
ESCUELA BASICA SAN ROQUE,274
ESCUELA BASICA ANDINA,275
ESCUELA BASICA TALABRE,276
ESCUELA BASICA SAN BARTOLOME,277
LICEO INDUSTRIAL EULOGIO GORDO MONEO,279
LICEO COMERCIAL JERARDO MUNOZ CAMPO,280
LICEO A. RENDIC I. ANEXO C. REHABILIT. SOCIAL,282
LICEO TECNICO DE ANTOFAGASTA,283
LICEO MARIO BAHAMONDE SILVA,284
LICEO MARTA NAREA DIAZ,285
LICEO LA PORTADA,286
LICEO DOMINGO HERRERA RIVERA,287
ESCUELA JAPON,288
ESCUELA ESPANA,289
ESCUELA PADRE GUSTAVO LE PAIGE WALQUE,291
ESCUELA REPUBLICA DE ITALIA,292
ESCUELA JOSE PAPIC RADNIC,293
ESCUELA PROFESORA LJUBICA DOMIC WUTH,294
ESCUELA REPUBLICA DE LOS ESTADOS UNIDOS,296
ESCUELA ALCALDE MAXIMILIANO POBLETE,297
ESCUELA DARIO SALAS DIAZ,298
ESCUELA ROMULO J. PENA MATURANA,301
ESCUELA JUAN LOPEZ,302
ESCUELA REPUBLICA ARGENTINA,303
LICEO ANDRES SABELLA,304
ESCUELA GONZALEZ ECHEGOYEN,305
ESCUELA HUANCHACA,306
ESCUELA CLAUDIO MATTE PEREZ,310
ESCUELA ECUADOR,312
ESCUELA ARTURO PRAT,313
ESCUELA HEROES DE LA CONCEPCION,315
ESCUELA LAS AMERICAS,316
ESCUELA LAS ROCAS,317
ESCUELA EDDA CUNEO DONNAGIO,318
ESCUELA LA BANDERA,319
ESCUELA ARMANDO CARRERA GONZALEZ,320
ESCUELA GENERAL MANUEL BAQUEDANO,322
ESCUELA FUNDACION MINERA ESCONDIDA,324
ESCUELA SANTIAGO AMENGUAL B.,326
ESCUELA LIBERTADORES DE CHILE,329
ESCUELA GABRIELA MISTRAL,332
COLEGIO EVANGELICO JOSE LANCASTER,335
LICEO EXPERIMENTAL ARTISTICO-APLICACION,336
ESCUELA PARTICULAR SANTA TERESITA,337
ESCUELA PARTICULAR ADVENTISTA,341
COLEGIO INGLES SAN JOSE,342
ESCUELA PRESBITERIANA,343
COLEGIO SANTA EMILIA,344
ESCUELA PARTICULAR LIDIA MORENO,350
"COL. KID""S SCHOOL",354
INS. CHILENO NORTEAMERICANO CULTURA,355
ESCUELA PARTICULAR CORAZON DE MARIA,356
COL. SAN LUIS,357
INS. SANTA MARIA,358
COL. THE ANTOFAGASTA BRITISH SCHOOL,361
COL. ANTOFAGASTA,364
COLEGIO EAGLE SCHOOL,365
HRVATSKA SKOLA S. ESTEBAN (EX-J. SKOLA),366
COMPLEJO EDUCATIVO JUAN JOSE LATORRE BENAVENT,367
ESCUELA BASICA JULIA HERRERA VARAS,368
ESCUELA LUCILA GODOY ALCAYAGA,369
ESCUELA ESTACION BAQUEDANO,370
ESCUELA CARACOLES,371
LICEO POLITECNICO JOSE MIGUEL QUIROZ,372
LICEO JUAN CORTES-MONROY CORTES,373
ESCUELA HOGAR VICTORIANO QUINTEROS SOTO,374
ESCUELA VICTOR CARVAJAL MEZA,375
ESCUELA PARANAL,377
LICEO FEDERICO VARELA,379
ESCUELA BASICA DIEGO PORTALES PALAZUELOS,380
ESCUELA BASICA PEDRO LUJAN,381
ESCUELA BASICA GASPAR CABRALES,382
LICEO MANUEL MAGALHAES MEDLING,384
ESCUELA ALIRO LAMAS CASTILLO,386
ESC. BASICA EMPERATRIZ SEPULVEDA LANDEROS,387
ESCUELA COEDUCACIONAL PARTICULAR,390
ESCUELA COEDUCACIONAL PARTICULAR OSCAR Y,391
LICEO DIEGO DE ALMEIDA,392
INSTITUTO COMERCIAL ALEJANDRO RIVERA DIAZ,396
ESC. DE REHAB.SOCIAL MEDARDO CANO GODOY,397
LICEO JOSE ANTONIO CARVAJAL,399
LICEO MERCEDES FRITIS MACKENNEY,400
ESCUELA BERNARDO O¦HIGGINS,401
ESCUELA RUDECINDO ARMANDO PENA CARRASCO,402
ESCUELA LAURA ROBLES SILVA,403
ESCUELA LOS ESTANDARTES,405
ESCUELA VICENTE SEPULVEDA ROJO,406
ESCUELA JESUS FERNANDEZ HIDALGO,407
ESCUELA PEDRO LEON GALLO,408
ESCUELA JOSE MANSO DE VELASCO,410
ESCUELA LAS CANTERAS,411
ESCUELA LAS BRISAS,413
LICEO DE MUSICA,415
ESCUELA ABRAHAM SEPULVEDA PIZARRO,416
COLEGIO BUEN PASTOR,417
ESCUELA ISABEL PENA MORALES,418
ESCUELA HERNAN MARQUEZ HUERTA,419
ESCUELA FUNDICION PAIPOTE,420
ESCUELA BRUNO ZAVALA FREDES,421
ESCUELA SAN PEDRO,423
ESCUELA LUIS CRUZ MARTINEZ,427
LICEO CATOLICO ATACAMA,429
LICEO POLITECNICO BELEN,430
LICEO SAGRADO CORAZON,431
COLEGIO ADVENTISTA DE COPIAPO,433
ESCUELA SAN VICENTE DE PAUL,434
ESCUELA TECNICO PROFESIONAL,437
LICEO MANUEL BLANCO ENCALADA,438
ESCUELA TOTORAL,439
COLEGIO PARROQUIAL PADRE NEGRO,440
ESCUELA DE CONCENTRACION,441
ESCUELA VICTOR MANUEL SANCHEZ CABANAS,442
ESCUELA LUIS URIBE ORREGO,444
ESCUELA PAUL HARRIS,445
ESCUELA AMOLANAS,446
ESCUELA SAN ANTONIO,447
LICEO PEDRO TRONCOSO MACHUCA,448
LICEO JOSE SANTOS OSSA,449
ESCUELA HERMANOS CARRERA,450
ESCUELA GABRIELA MISTRAL,452
ESCUELA IGNACIO CARRERA PINTO,453
ESCUELA GREGORIO CASTILLO MARÍN,454
ESCUELA REPUBLICA DE LOS E.E.U.U.,455
ESCUELA ARTURO PEREZ CANTO,458
ESCUELA BASICA ESPANA,459
ESCUELA LUIS CRUZ MARTINEZ,461
ESCUELA JOSE CAROCA LAFLOR,462
ESCUELA BASICA ROBERTO CUADRA ALQUINTA,463
ESCUELA BASICA GUALBERTO KONG FERNANDEZ,464
ESCUELA BASICA JAVIERA CARRERA,466
ESCUELA HERNAN ARAVENA CONTRERAS,467
ESCUELA BASICA IGNACIO FRANCO GALLO,468
ESCUELA BASICA JUSTINO LEIVA AMOR,469
ESCUELA BASICA SARA BEMBOW VILLEGAS,471
ESCUELA DE HACIENDA LAS VENTANAS,472
ESCUELA BASICA CAMARONES,475
ESCUELA BASICA SOR TERESA DE LOS ANDES,476
LICEO SANTA MARTA,478
LICEO SAN FRANCISCO,479
ESCUELA BASICA ALEJANDRO NOEMI HUERTA,481
ESCUELA FORTUNATO SOZA RODRIGUEZ,482
ESCUELA SAMUEL E. CASTILLO LOPEZ,483
ESCUELA DE MAITENCILLO,484
ESCUELA BASICA YERBAS BUENAS,485
LICEO JAPON,486
ESCUELA BASICA JOSE MIGUEL CARRERA,487
ESCUELA EL OLIVAR,489
ESCUELA PABLO NERUDA,490
COLEGIO PARTICULAR ENGLISH COLLEGE,492
EDUCADOR ARTURO ALVEAR RAMOS,493
ESCUELA AGLADE MARIN VARGAS,495
ESCUELA DE CHOLLAY,496
ESCUELA DE LA PAMPA,497
ESCUELA ALGARROBILLA,498
ESCUELA RICARDO CAMPILLAY CONTRERAS,499
ESCUELA BASICA RURAL EL TAMBO,500
ESCUELA DE LAS MARQUESAS,502
ESCUELA DE LAS BREAS,503
ESCUELA GABRIELA MISTRAL,504
ESCUELA DE LOS PERALES,506
ESCUELA DE CHIGUINTO,508
ESC.BASICA ALDECIRA ALVAREZ A.,509
ESCUELA DE EL CORRAL,514
LICEO GABRIELA MISTRAL DE LA SERENA,516
LICEO GREGORIO CORDOVEZ,517
LICEO TECNICO MARTA BRUNET,518
COLEGIO ARTURO PRAT CHACON,519
COLEGIO JOSE GASPAR MARIN ESQUIVEL,520
COLEGIO VICTOR DOMINGO SILVA,521
COLEGIO JAVIERA CARRERA,522
ESCUELA ALONSO DE ERCILLA,523
COLEGIO JAPON,525
COLEGIO JOSE MANUEL BALMACEDA,526
COLEGIO HEROES DE LA CONCEPCION,527
ESCUELA GERMAN RIESCO,528
COLEGIO MANUEL RODRIGUEZ,529
COLEGIO GABRIEL GONZALEZ VIDELA,530
COLEGIO PEDRO AGUIRRE CERDA,531
CEN.ED.INT.DE ADUL.ESTER VILLARREAL CASTILLO,532
COLEGIO DARIO SALAS,533
COLEGIO VILLA SAN BARTOLOME,534
COLEGIO JOSE MIGUEL CARRERA,535
COLEGIO BERNARDA MORIN,536
COLEGIO LUIS BRAILLE,537
COLEGIO DE ALGARROBITO,539
ESCUELA DE ISLON,540
ESCUELA DE LAMBERT,542
COLEGIO ALTOVALSOL,543
COLEGIO COQUIMBITO,546
ESCUELA DE COLONIA ALFALFARES,548
ESCUELA DE LOS CORRALES,549
ESCUELA DE ALMIRANTE LATORRE,550
ESCUELA DE LAS ROJAS,551
ESCUELA DE CHACAY ALTO,552
ESCUELA DE BELLAVISTA,553
ESCUELA DE PELICANA,554
ESCUELA DE ROMERO,556
ESCUELA DE SATURNO,557
COLEGIO PUNTA DE TEATINOS,558
COLEGIO QUEBRADA DE TALCA,560
COLEGIO EL ROMERAL,561
COLEGIO CALETA SAN PEDRO,562
COLEGIO LA LAJA,563
COLEGIO LA ESTRELLA,564
COLEGIO PARTICULAR ADVENTISTA MARANATA,565
COLEGIO ISABEL RIQUELME,566
ESCUELA PARTICULAR OSCAR ALDUNATE ABBOTT,567
COLEGIO SAN ANTONIO,568
COLEGIO ELENA BETTINI,570
ESCUELA PARTICULAR TERESA VIDELA DE G,573
ESCUELA  INDUSTRIAL SALESIANA SAN RAMON,574
COLEGIO PROVIDENCIA,575
COLEGIO JULIA DE LA BARRA CAMPOS,577
LICEO IGNACIO CARRERA PINTO,578
COLEGIO SEMINARIO CONCILIAR,579
COLEGIO GERONIMO RENDIC,580
ESCUELA EXPERIMENTAL DE MUSICA,581
COLEGIO ANDRES BELLO,582
COLEGIO SAGRADOS CORAZONES,583
COLEGIO THE INTERNATIONAL SCHOOL,585
COLEGIO SERENA,587
COLEGIO SANTO DOMINGO,589
COLEGIO PARTICULAR SAN JOSE,590
COLEGIO INGLES CATOLICO,591
COLEGIO FRANCISCO DE AGUIRRE,594
ESCUELA BASICA PEDRO PABLO MUNOZ,597
ESCUELA DE PUNTA DE CHOROS,598
ESCUELA JOSE SANTOS OSSA,599
ESCUELA DE LOS MORROS,601
ESCUELA BASICA CARLOS CONDELL,602
ESCUELA DE PUNTA COLORADA,604
ESCUELA DE CRUZ GRANDE,606
ESCUELA DE LOS CHOROS,608
INSTITUTO SUPERIOR DE COMERCIO DE COQUIMBO,609
LICEO INDUSTRIAL JOSE TOMAS DE URMENETA,610
LICEO MUNICIPAL DIEGO PORTALES PALAZUELO,611
ESCUELA GUILLERMO CERECEDA,612
COLEGIO DE ARTES CLAUDIO ARRAU,613
ESCUELA PRESIDENTE ANIBAL PINTO,614
ESCUELA COQUIMBO,615
ESCUELA CARDENAL JOSE MARIA CARO,616
COLEGIO SANTA CECILIA,617
ESCUELA SANTO TOMAS DE AQUINO,618
ESCUELA JOSE ALFARO ALFARO,620
ESCUELA BASICA MARIO MUNOZ SILVA,621
ESCUELA TOMASA OLIVARES CAAMANO,625
ESCUELA BASICA DAVID LEON TAPIA,626
ESCUELA DE PENUELAS,628
ESCUELA PABLO NERUDA,629
COLEGIO LA HERRADURA,630
ESCUELA DE PAN DE AZUCAR,631
ESCUELA BASICA MANUEL DE SALAS,632
ESCUELA DE HUACHALALUME,634
ESCUELA DE TOTORALILLO,635
ESCUELA LUCILA GODOY ALACAYAGA,637
ESCUELA DE CAMARONES,638
ESCUELA DE LAS BARRANCAS,639
ESCUELA DE EL MOLLACO,640
ESCUELA DE LAS CARDAS,641
ESCUELA DE EL PENON,642
ESCUELA DE TAMBILLOS,643
ESCUELA DE PUERTO ALDEA,644
ESCUELA DE EL TANGUE,645
COLEGIO BERNARDO O'HIGGINS,646
COLEGIO MANUEL MONTT,647
COLEGIO SANTA MARTA,648
COLEGIO PARTICULAR GABRIELA MISTRAL,649
ESCUELA PARTICULAR METODISTA,650
COLEGIO PARTICULAR SAN IGNACIO,655
LICEO PEDRO REGALADO S. VIDELA O.,656
ESCUELA LUIS CRUZ MARTINEZ,657
ESCUELA PATRICIO LYNCH,658
ESCUELA PADRE BLAS HERNANDEZ SANCHEZ,659
ESCUELA LUIS AMENABAR OSSA,661
ESCUELA DE MAITENCILLO,662
ESCUELA PADRE CLARET,663
ESCUELA CORAZON DE MARIA,664
LICEO CARLOS ROBERTO MONDACA CORTES,665
ESCUELA BASICA LUCILA GODOY ALCAYAGA,666
ESCUELA EDMUNDO VIDAL CARDENAS,668
ESCUELA DE EL TAMBO,669
ESCUELA RIOS DE ELQUI,671
ESCUELA DE DIAGUITAS JUAN TORRES M.,672
ESCUELA JOSE ABELARDO NUNEZ,673
ESCUELA DE VINITA ALTA,674
ESCUELA DE SAN CARLOS,676
ESCUELA AMELIA BARAHONA MUJICA,678
ESCUELA FEDERICO BARNES PAYNE,680
ESCUELA DE EL ARENAL,681
ESCUELA DAGOBERTO CAMPOS NUNEZ,682
ESCUELA DE LA CALERA,683
ESCUELA DE LA POLVADA,685
ESCUELA MARIO AQUILES RODRIGUEZ,686
ESCUELA DE HUANTA,687
ESCUELA DE CHAPILCA,688
ESCUELA DE VARILLAR,689
COLEGIO ANTONIO VARAS,690
ESCUELA MUNICIPAL CIELO CLARO--PAIHUANO,691
ESCUELA JERONIMO GODOY VILLANUEVA,692
ESCUELA MUNICIPAL QUEBRADA DE PAIHUANO,693
ESCUELA GABRIELA MISTRAL,694
ESCUELA MUNICIPAL TRES CRUCES,695
ESCUELA MUNICIPAL LA ORTIGA,696
ESCUELA MUNICIPAL ALCOHUAZ,697
ESCUELA MARIA ISABEL PERALTA P.,699
LICEO ESTELA AVILA DE PERRY,701
LICEO ALEJANDRO ALVAREZ JOFRE,704
LICEO POLITECNICO DE OVALLE,705
COLEGIO FRAY JORGE,706
ESCUELA BASICA HELENE LANG,707
ESCUELA ANTONIO TIRADO LANAS,708
ESCUELA BASICA OSCAR ARAYA MOLINA,709
ESCUELA BASICA JOSE TOMAS OVALLE B.,710
ESCUELA GUARDIAMARINA ERNESTO RIQUELME V,711
ESCUELA BASICA ARTURO ALESSANDR PALMA,712
ESCUELA ARTURO VILLALON SIEULANNE,713
ESCUELA BASICA VISTA HERMOSA,714
ESCUELA BASICA BERNARDO O¦HIGGINS RIQUELME,715
ESC.PADRE JOSEPH BENEDIKT STEGMEIER,716
ESCUELA MARCOS MACUADA OGALDE,718
ESCUELA BASICA FLORENCIO ESPINOZA LOPEZ,721
ESC. HEBERTO VELAZQUEZ VELAZQUEZ,722
ESCUELA VILLORRIO EL TALHUEN,723
ESCUELA BASICA CALETA EL MAITEN,724
ESCUELA EL CRISOL,725
ESCUELA QUEBRADA SECA DE SOTAQUI,726
ESCUELA LA PALOMA,727
ESCUELA EL ALGARROBO,728
ESCUELA BASICA LOS OLIVOS,729
ESCUELA BASICA LUCIA NUNEZ DE LA CUADRA,730
ESCUELA EL TRAPICHE,731
ESCUELA PADRE DAMIAN HEREDIA,733
ESCUELA LA QUIROGA,735
ESCUELA BASICA LOS SOSSAS,736
ESCUELA BASICA VALENTIN LETELIER,737
ESCUELA PEDRO ENRIQUE ALFONSO BARRIOS,740
ESCUELA CARACHILLA,743
ESCUELA ORURO,744
ESCUELA LA HIGUERA DE PALOMA,745
ESCUELA EL SAUCE,746
ESCUELA CERRO TAMAYA,747
ESCUELA TRANQUE RECOLETA,749
ESCUELA LVIRA DEL CARMEN OCHOA  AVILES,750
ESCUELA VALLE HERMOSO,752
ESC.BAS.JUAN PABLO ARTIGUES PENAFIEL,753
ESCUELA LA ARAUCANA,754
ESCUELA CANELILLA,755
ESCUELA SANTA CATALINA,756
ESCUELA BASICA EL GUINDO,757
ESCUELA CORDILLERA,758
ESCUELA BASICA GASPAR CABRALES,759
ESCUELA LAS LOMAS DE PUNILLA,760
ESCUELA CALETA EL TORO,762
COLEGIO SAN JUAN BAUTISTA,763
COLEGIO SANTA MARIA EUFRASIA,766
COLEGIO PARTICULAR GABRIELA MISTRAL,767
COLEGIO LA PROVIDENCIA,768
COLEGIO SAN VIATOR,769
COLEGIO AMALIA ERRAZURIZ,770
ESCUELA PARTICULAR EL ARRAYAN,771
LICEO AGRICOLA DE OVALLE TADEO PERRY BARN,772
ESCUELA SAMO ALTO,773
ESCUELA BASICA DE PICHASCA,774
ESCUELA BASICA DE FUNDINA,775
ES.BAS.SAN PEDRO DE RIO HURTADO,776
ESC.BASICA  HIJOS DE EL CHANAR,777
ESCUELA BASICA LAS BREAS,778
ESCUELA BASICA TABAQUEROS,780
ESCUELA DOCTOR JOSE LUIS ARRANO,783
ESCUELA BASICA  HUAMPULLA,784
ESCUELA BASICA LOS MAITENES DE SAMO ALTO,785
ESCUELA BASICA  LA HUERTA,786
ESCUELA BASICA MORRILLOS,787
ESCUELA BASICA VADO DE MORRILLOS,788
ESCUELA EL ESPINAL DE RIO HURTADO,789
ESCUELA BASICA EL ROMERAL,790
ESCUELA BASICA  ESTANCIA EL SAUCE,792
ESCUELA BASICA DE  SERON,793
ESC.BASICA DOMINGO SANTA MARIA GONZALEZ,795
ESCUELA LOS MAITENES DE SERON,797
ESCUELA EL PALQUI,798
COLEGIO REPUBLICA DE CHILE,799
ESCUELA HUATULAME,800
LICEO PRESIDENTE EDUARDO FREI MONTALVA,802
ESC.CONCENTRACION FRONTERIZA DE TULAHUEN,803
ESCUELA BASICA WENCESLAO VARGAS,804
ESCUELA EL MAQUI,805
ESCUELA FRONTERA LAS RAMADAS,806
ESCUELA EL MAITEN,807
ESCUELA BASICA TULAHUEN PONIENTE,808
ESCUELA DE HUANILLA,809
ESCUELA CENTRAL HIDROELECTRICA LOS MOLLE,810
ESCUELA VARILLAR,811
ESCUELA SOL DE LAS PRADERAS,812
ESCUELA BASICA LA UNION,813
ESCUELA BASICA EL TAYAN,814
ESCUELA GUSTAVO CONTRERAS CASTRO,816
ESCUELA NUEVA ESPERANZA DE PEJERREYES,817
ESCUELA LOS CLONQUIS,818
ESCUELA BUENAVENTURA,819
ESCUELA SOL DEL CUYANO,820
ESCUELA DE FLOR DEL VALLE,821
ESCUELA JUNTAS,822
ESCUELA BASICA COLLIGUAY,823
ESCUELA HEROES DE CHILE,824
ESCUELA BASICA PABLO NERUDA,825
ESCUELA BASICA HACIENDA VALDIVIA,826
COLEGIO RIO GRANDE,827
ESCUELA FLOR DE LAS ANDES,828
ESCUELA MARCELA PAZ,830
ESCUELA VALLE NEVADO,831
ESCUELA SANTA BERNARDITA,833
ESCUELA SARGENTO CANDELARIA PEREZ,834
ESCUELA CARMELA PRAT,835
ESCUELA INES DE SUAREZ,836
ESCUELA ESPERANZA DE HUANA,837
ESCUELA PROFESOR MANUEL ORTIZ QUINTANA,838
ESCUELA CHILECITO,839
ESCUELA OMAR ELORZA SMITH,840
ESCUELA PULPICA,841
ESCUELA LOS PERALES DE CAMPANARIO,843
ESCUELA PARTICULAR CERRILLOS DE RAPEL,844
LICEO SAMUEL ROMAN ROJAS,845
ESCUELA BASICA AMERICA,847
ESCUELA ALEJANDRO CHELEN ROZAS,848
ESCUELA BASICA JUANITA FERNANDEZ SOLAR,849
ESCUELA JUAN LUIS SAN FUENTES,850
ESCUELA BASICA ARTURO PEREZ CANTO,851
ESCUELA BASICA PEDRO DE VALDIVIA,852
ESCUELA RAFAEL SOTOMAYOR,854
ESCUELA IRENE MORALES,856
ESCUELA LOS MORALES,857
ESCUELA REBECA MATTE DE INIGUEZ,859
ESCUELA ESTRELLA DE BELEN,862
ESCUELA BASICA ALBERTO ORREGO LUCO,864
ESCUELA BASICA DANIEL BARROS GREZ,865
ESCUELA BASICA OSCAR CASTRO ZUNIGA,866
ESCUELA SAN JUDAS TADEO DE CARCAMO,867
ESCUELA AMERICA DE SUR,868
ESCUELA BASICA REBECA PONCE DE LEON V.,869
ESCUELA BASICA CAMILO HENRIQUEZ GONZALEZ,870
ESCUELA BASICA LUIS ENRIQUE BOU PEREZ,871
ESCUELA BASICA ROSITA OHIGGINS,872
ESCUELA BASICA LAURITA VICUNA,874
ESCUELA BASICA PEDRO LIRA RENCORET,875
ESCUELA BASICA CLAUDIO MATTE,876
ESCUELA JOSE JOAQUIN VALLEJOS,878
ESCUELA BASICA BENJAMIN VICUNA MACKENNA,879
ESCUELA CINCO DE ABRIL,882
ESCUELA BASICA SAN LUIS AMIGO Y FERRER,883
ESCUELA BASICA JUAN FRANCISCO GONZALEZ,884
ESCUELA LA VARIOLA,886
ESCUELA BASICA CAUPOLICAN,887
ESCUELA BASICA BOSQUE DE QUILLAY,888
ESCUELA BASICA PAUL HARRIS,889
ESCUELA PARTICULAR LOS SAPOS,890
ESCUELA PARTICULAR RINCON DE LAS CHILCAS,891
ESCUELA PARTICULAR EL DURAZNO,892
ESCUELA PARTICULAR EL DIVISADERO,893
ESCUELA PARTICULAR LA COLORADA,896
ESCUELA BELGICA,897
ESCUELA LUZ DE LUNA,899
ESCUELA BASICA LA HIGUERA DE QUILE,900
ESCUELA VINA VIEJA,901
ESCUELA BASICA EL TABACO,902
ESCUELA CAMPO LINDO,904
ESCUELA CHALINGA,905
ESCUELA LOS CANELOS,906
ESCUELA HIJOS DEL PERAL,907
ESCUELA TABALI,908
ESCUELA LOS AZAHARES DE CERRO BLANCO,909
ESC.BASICA SAN ANTONIO DE LA VILLA,910
ESCUELA LOS TRIGOS,911
ESCUELA PENA BLANCA,914
ESCUELA MARCOS RIGOBERTO  PIZARRO ARAYA,915
ESCUELA BARRAZA BAJO,916
ESCUELA RINCON DE LA CALERA,917
ESCUELA BASICA LAS NIPAS,922
ESCUELA EL MAQUI DE QUILE,923
ESCUELA LOS ACACIOS,924
ESCUELA BASICA VILLA LOS QUILES,925
ESCUELA ALTAR ALTO,926
ESCUELA BASICA GRANEROS,928
ESCUELA LOS NOGALES,929
ESCUELA SAN ANTONIO DE PADUA,931
ESCUELA UNION CAMPESINA,932
ESCUELA LAS CRUCES,933
ESCUELA BEATRIZ VEGA VEGA,934
ESCUELA SALALA,935
ESCUELA EL ESPINAL,936
ESCUELA ALCONES BAJOS,937
ESCUELA ALMENDRO DE QUILE,939
ESCUELA SAN PEDRO,940
ESCUELA PADRE PABLO DIEHL HARTMAN,943
ESCUELA SOL NACIENTE,945
ESCUELA TERESITA DE LOS ANDES,946
ESCUELA AURORA DE CHILE,947
ESCUELA BASICA LAS AGUILAS,948
ESCUELA EL DURAZNO DE QUILE,949
ESCUELA LA CEBADAS,950
ESCUELA LA CALERA DE SAN JULIAN,951
ESCUELA BASICA LOS CIENAGOS,952
ESCUELA PATRICIO ZEBALLOS,953
ESCUELA EL AJIAL DE QUILE,954
ESCUELA VILLA LOS CORRALES,955
ESCUELA PORTEZUELOS BLANCOS,956
ESCUELA EL CIENAGO,957
COLEGIO PARTICULAR SALI HOCHSCHILD,959
ESCUELA PARTICULAR EL LLANITO,960
ESCUELA ALGARROBO DE HORNILLOS,962
ESCUELA PARTICULAR EL TENIENTE,963
ESCUELA BASICA MUNICIPAL DE ADULTOS,964
LICEO DOMINGO ORTIZ DE ROZAS,967
LICEO POLITECNICO PABLO RODRIGUEZ CAVIEDES,968
ESCUELA BASICA VALLE DEL CHOAPA,969
ESCUELA JUAN CARRASCO RISCO,970
ESCUELA BASICA SAN RAFAEL DE ROZAS,971
ESCUELA BASICA JORGE ARACENA RAMOS,972
ESCUELA BASICA CLEMENCIA VILLARROEL,973
ESCUELA BASICA CAMILO HENRIQUEZ,974
ESCUELA BASICA LAS PALMERAS DE LIMAHUIDA,976
ESCUELA BASICA GRACIELA DIAZ ALLENDE,977
ESCUELA BASICA MATANCILLA,978
ESCUELA BASICA CHOAPA LINDO,981
ESCUELA BASICA VILLA LOS NARANJOS,982
ESCUELA BASICA LAS LILAS DE TUNGA NORTE,983
ESCUELA BASICA TUNGA SUR,984
ESCUELA BASICA ASIENTO VIEJO,985
ESCUELA BASICA LAS CHINCHILLAS DE COCOU,986
COLEGIO SANTA TERESA,987
LICEO PARTICULAR LUIS ALBERTO VERA,988
ESCUELA PARTICULAR LAS CANAS,990
ESCUELA PARTICULAR QUEBRADA EL PERAL,991
ESCUELA PARTICULAR CANELILLO ALTO,993
ESCUELA PARTICULAR RINCON DEL ROMERO,994
ESCUELA PARTICULAR CAREN,995
ESCUELA PARTICULAR EL LANCO,996
ESCUELA PARTICULAR QUEBRADA DE CARCAMO,997
ESCUELA PARTICULAR ILTA,998
ESCUELA PARTICULAR 18 DE SEPTIEMBRE,999
ESCUELA PARTICULAR SAN ENRIQUE,1000
ESCUELA PARTICULAR HERMINIA RAMOS,1001
ESCUELA PARTICULAR EL SOCAVON,1002
ESCUELA PARTICULAR SAN ROMUALDO,1003
ESCUELA PARTICULAR LA CAPILLA,1004
ESCUELA PARTICULAR RINCON DE TUNGA,1005
ESCUELA MANUEL JOSE IRARRAZAVAL,1006
ESCUELA PARTICULAR CANAS DE MICHIO,1007
ESCUELA PARTICULAR QUILLAICILLO,1008
ESCUELA PARTICULAR CUYUNTAGUA,1010
ESCUELA PARTICULAR MACUCO,1011
LICEO DE SALAMANCA,1013
ESCUELA MATILDE SALAMANCA,1014
ESCUELA BASICA DIAGUITAS DE CHALINGA,1015
ESCUELA TRANQUILLA,1016
ESCUELA BASICA BERTA HIDALGO BARAHONA,1017
ESCUELA EL TAMBO,1018
ESCUELA BASICA  CHILLEPIN,1019
ESCUELA BASICA GUISELA GAMBOA SALINAS,1020
ESCUELA ZAPALLAR,1021
ESCUELA COIRON,1022
ESCUELA BASICA EL TEBAL,1023
ESCUELA LLIMPO,1024
ESCUELA LA HIGUERILLA,1025
ESCUELA BASICA QUELEN BAJO,1027
ESC.BASICA GUILLERMO BARRIOS VARGAS,1030
ESCUELA BASICA JULIO ECHAVARRIA,1031
ESCUELA BASICA SAN AGUSTIN,1032
ESCUELA BASICA PANGUESILLO,1033
ESCUELA LOS CORRALES,1034
COLEGIO PARTICULAR SAN FRANCISCO DE ASIS,1036
ESCUELA PARTICULAR HUANQUE,1037
ESCUELA PARTICULAR EL PALQUIAL,1038
ESCUELA BASICA JORQUERA,1039
ESCUELA PARTICULAR LAS JARILLAS,1040
ESCUELA PARTICULAR CAJON DE QUELEN,1041
ESCUELA MUNICIPAL COLLIGUAY,1042
ESCUELA PARTICULAR MANQUEHUA,1044
ESCUELA PARTICULAR PUNTA NUEVA,1045
ESCUELA PARTICULAR PLANTA PELADEROS,1046
ESCUELA PARTICULAR VALLE CAMISAS,1047
LICEO NICOLAS FEDERICO LOHSE VARGAS,1048
COLEGIO DIEGO DE ALMAGRO,1049
ESCUELA BASICA ERCOLE BENCINI,1050
ESCUELA BASICA TERESA CANNON DE B.,1051
ESCUELA BASICA PABLO BARRIOLHET,1052
ESCUELA BASICA FORJADORES DE CHILE,1053
ESCUELA,1054
ESCUELA LOS MAQUIS,1055
ESCUELA CLARA VIAL ORREGO,1059
ESCUELA TILAMA,1061
ESC.PDTE.FEDERICO ERRAZURIZ ECHAURREN,1062
ESCUELA,1063
ESCUELA BASICA EL QUELON,1064
ESCUELA BASICA EL MANZANO,1065
ESCUELA PARTICULAR DIVINA PROVIDENCIA,1066
ESCUELA PARTICULAR CULIMO,1068
ESCUELA PARTICULAR MINA LAS VACAS,1069
ESCUELA PARTICULAR PUPIO,1070
ESCUELA PARTICULAR EL ROMERO,1071
ESCUELA PARTICULAR INFIERNILLO,1072
ESCUELA PARTICULAR EL RINCON,1073
ESCUELA PARTICULAR MAIMALICAN,1076
ESCUELA MUNICIPAL CANELA BAJA,1077
ESCUELA BASICA JUAN ANTONIO RIOS,1078
ESC.BASICA JOSE ANTONIO ECHAVARRIA,1080
ESC.BASICA EUSEBIO LILLO ROBLES,1081
ESC.BASICA MERCEDES MARIN DEL SOLAR,1082
ESCUELA BASICA CARQUINDANO,1083
ESCUELA BASICA JABONERIA,1084
ESCUELA BASICA PABLO NERUDA,1085
ESCUELA BASICA MARIANO LATORRE,1086
ESCUELA BASICA CANELA ALTA,1087
ESC.BASICA CARLOS IBANEZ DEL CAMPO,1090
ESCUELA BASICA MINCHA NORTE,1092
ESCUELA BASICA ATELCURA ALTA,1093
ESCUELA BASICA POZA HONDA,1094
ESCUELA BASICA SARGENTO ALDEA,1095
ESCUELA BASICA  LOS POZOS,1096
ESCUELA BASICA ESPIRITU SANTO,1097
ESCUELA VIOLETA PARRA,1099
ESC.BASICA CARLOS VIAL ESPANTOSO,1100
ESCUELA BASICA JOSE MIGUEL CARRERA,1101
ESCUELA BASICA  BALDOMERO LILLO FIGUEROA,1102
ESCUELA BASICA  VICTOR DOMINGO SILVA,1103
ESCUELA LA CORTADERA,1104
ESCUELA BASICA MARTA BRUNETT,1108
ESCUELA BASICA GABRIELA MISTRAL,1109
ESCUELA PARTICULAR EL POTRERO,1112
ESCUELA BASICA SALVADOR REYES,1113
ESCUELA PARTICULAR EL CHILCAL,1114
ESC.BASICA JUAN GUZMAN CRUCHAGA,1115
ESCUELA PARTICULAR CANELILLA,1116
ESCUELA PARTICULAR LOS TOMES,1117
COLEGIO PARTICULAR SANTA MARIA,1119
CENTRO DE EDUCACION DE ADULTOS LA LIGUA,1120
LICEO PULMAHUE DE LA LIGUA,1121
ESCUELA REPUBLICA DE VENEZUELA,1122
ESCUELA GABRIELA MISTRAL,1123
ESCUELA DIEGO PORTALES,1125
ESCUELA COMUNIDADES DE VALLE HERMOSO,1128
ESCUELA ANGEL MENAY,1129
ESC. BASICA LOS HORNOS DE HUAQUEN,1130
ESC. BASICA CASAS VIEJAS DE LONGOTOMA,1131
ESCUELA BASICA POZA VERDE,1132
ESC.BASICA LAS CASAS DE HUAQUEN,1133
CARMEN SANCHEZ ARAYA,1134
ESCUELA BASICA LOS MOLLES,1135
ESCUELA BASICA PUYANCON,1136
ESCUELA BASICA HORTENCIA POWELL S.,1137
